{
  "$schema": "https://json-schema.org/draft/2020-12/schema",
  "$id": "https://raw.githubusercontent.com/marshallguillory86/secure-code-agent/main/secure-code-agent.schema.json",
  "title": "secure-code-agent config",
  "description": "Configuration schema for secure-code-agent. See docs/design.md for semantics.",
  "type": "object",
  "additionalProperties": false,
  "properties": {
    "$schema": {
      "type": "string",
      "description": "JSON Schema reference used by editors and validators."
    },
    "version": {
      "type": "integer",
      "enum": [
        1
      ]
    },
    "paths": {
      "type": "object",
      "additionalProperties": false,
      "properties": {
        "include_extensions": {
          "type": "array",
          "items": {
            "type": "string"
          },
          "description": "File extensions to consider in scope (e.g. '.py', '.ts')."
        },
        "exclude_patterns": {
          "type": "array",
          "items": {
            "type": "string"
          },
          "description": "Glob patterns to exclude. Tested against POSIX-normalized relative paths."
        },
        "test_patterns": {
          "type": "array",
          "items": {
            "type": "string"
          },
          "description": "Paths that are this repository's own test tree. Findings there are reported separately rather than scored \u2014 a project graded on its test fixtures is graded on the wrong thing. Not an exclusion: the findings are still collected and reported, and secrets among them still score and still gate, because a committed credential is a leak wherever it lives. Same glob syntax as exclude_patterns."
        },
        "docs_patterns": {
          "type": "array",
          "items": {
            "type": "string"
          },
          "description": "Documentation and tutorial sources. Prose is not the shipped source, and a credential in a tutorial is an illustration \u2014 FastAPI's docs_src/ carries example JWTs that scored as critical secrets. Findings here are reported and still gated, never scored as code condition. Same glob syntax as exclude_patterns."
        }
      }
    },
    "scanners": {
      "type": "object",
      "description": "Per-scanner configuration. Unknown scanner names are rejected at runtime.",
      "additionalProperties": {
        "type": "object",
        "additionalProperties": false,
        "properties": {
          "enabled": {
            "type": "boolean",
            "default": true
          },
          "timeout_seconds": {
            "type": "integer",
            "minimum": 1,
            "default": 600
          },
          "online": {
            "type": "boolean",
            "default": false
          },
          "extra_args": {
            "type": "array",
            "items": {
              "type": "string"
            }
          },
          "command": {
            "type": "array",
            "minItems": 1,
            "items": {
              "type": "string",
              "minLength": 1
            },
            "description": "Explicit executable command. Relative executable paths resolve from the scan target. Executed without a shell."
          },
          "mode": {
            "type": "string",
            "enum": [
              "auto",
              "requirements",
              "project",
              "locked",
              "environment"
            ],
            "default": "auto",
            "description": "Input mode used by pip_audit; ignored by other scanners."
          },
          "inputs": {
            "type": "array",
            "items": {
              "type": "string",
              "minLength": 1
            },
            "description": "Explicit scanner inputs, resolved from the scan target. Currently used by pip_audit."
          }
        }
      }
    },
    "severity_overrides": {
      "type": "object",
      "description": "Override scanner-emitted severity per rule id.",
      "additionalProperties": {
        "type": "string",
        "enum": [
          "critical",
          "high",
          "medium",
          "low",
          "informational"
        ]
      }
    },
    "category_overrides": {
      "type": "object",
      "description": "Override category mapping per rule id.",
      "additionalProperties": {
        "type": "string",
        "enum": [
          "secrets",
          "dependencies",
          "code_vulnerabilities",
          "auth_authz",
          "crypto",
          "supply_chain",
          "config_iac",
          "logging_observability",
          "policy_docs"
        ]
      }
    },
    "gates": {
      "type": "object",
      "additionalProperties": false,
      "properties": {
        "fail_on_severity": {
          "type": "array",
          "items": {
            "type": "string",
            "enum": [
              "critical",
              "high",
              "medium",
              "low"
            ]
          }
        },
        "fail_on_category": {
          "type": "array",
          "items": {
            "type": "string",
            "enum": [
              "secrets",
              "dependencies",
              "code_vulnerabilities",
              "auth_authz",
              "crypto",
              "supply_chain",
              "config_iac",
              "logging_observability",
              "policy_docs"
            ]
          }
        },
        "fail_on_new": {
          "type": "boolean",
          "default": true
        },
        "min_score": {
          "type": "number",
          "minimum": 0,
          "maximum": 5
        },
        "require_scanners": {
          "type": "array",
          "minItems": 1,
          "items": {
            "type": "string"
          }
        },
        "max_unsuppressed": {
          "type": "object",
          "additionalProperties": false,
          "properties": {
            "critical": {
              "type": "integer",
              "minimum": 0
            },
            "high": {
              "type": "integer",
              "minimum": 0
            },
            "medium": {
              "type": "integer",
              "minimum": 0
            },
            "low": {
              "type": "integer",
              "minimum": 0
            }
          }
        }
      }
    },
    "outputs": {
      "type": "object",
      "additionalProperties": false,
      "properties": {
        "baseline_path": {
          "type": [
            "string",
            "null"
          ],
          "default": "secure-code-baseline.json"
        },
        "code_scanning_sarif_path": {
          "type": [
            "string",
            "null"
          ],
          "default": "secure-code.code-scanning.sarif",
          "description": "SARIF for upload to code scanning: sarif_path without results carrying suppressions, which GitHub code scanning turns into alerts regardless. Off unless declared."
        },
        "comment_path": {
          "type": [
            "string",
            "null"
          ],
          "default": "secure-code-pr-comment.md"
        },
        "history_path": {
          "type": [
            "string",
            "null"
          ],
          "default": ".secure-code/history.jsonl",
          "description": "Append-only JSONL trend log. null to disable."
        },
        "json_path": {
          "type": [
            "string",
            "null"
          ],
          "default": "secure-code-report.json"
        },
        "markdown_path": {
          "type": [
            "string",
            "null"
          ],
          "default": "secure-code-report.md"
        },
        "prompt_path": {
          "type": [
            "string",
            "null"
          ],
          "default": "secure-code-remediation-prompt.md"
        },
        "sarif_path": {
          "type": [
            "string",
            "null"
          ],
          "default": "secure-code.sarif"
        },
        "security_pillar_path": {
          "type": [
            "string",
            "null"
          ],
          "default": "security-pillar.json",
          "description": "security-pillar.json for maintainability-agent to ingest (D3). null to disable."
        },
        "work_order_json_path": {
          "type": [
            "string",
            "null"
          ],
          "default": "secure-code-work-order.json",
          "description": "The remediation work order as JSON: the same triage and caps as the prompt, as facts rather than prose, for a tool that renders its own presentation. Off unless declared."
        }
      }
    },
    "suppressions_file": {
      "type": "string",
      "default": ".scignore.yaml",
      "description": "Path to the suppressions file. Per design.md \u00a710."
    },
    "standards_overlay": {
      "type": [
        "string",
        "null"
      ],
      "default": null,
      "description": "Path to an operator standards overlay (YAML), layered over the shipped mapping table. May add or correct canonical_cwe, owasp_top10, asvs_section, nist_ssdf, short_desc and fix_hint. May NOT set severity, confidence or category: those are the scoring inputs and an overlay that set them could move the grade (D32). See product-intent.md \u00a78 question 3."
    },
    "loc_for_scoring": {
      "type": "object",
      "description": "Override the auto-computed LOC count (rare).",
      "additionalProperties": false,
      "properties": {
        "value": {
          "type": "integer",
          "minimum": 1
        },
        "reason": {
          "type": "string"
        }
      },
      "required": [
        "value",
        "reason"
      ]
    },
    "capabilities": {
      "type": "object",
      "additionalProperties": false,
      "description": "What this project declares it does, as name -> reason (D24). Declared, never inferred: findings that are a declared capability being exercised are counted and listed in the report, and left off the score. A declaration that matches no finding is reported as unexercised.",
      "properties": {
        "fetches_remote_urls": {
          "type": "string",
          "minLength": 1,
          "description": "Why this project exercises fetches_remote_urls."
        },
        "parses_untrusted_xml": {
          "type": "string",
          "minLength": 1,
          "description": "Why this project exercises parses_untrusted_xml."
        },
        "spawns_processes": {
          "type": "string",
          "minLength": 1,
          "description": "Why this project exercises spawns_processes."
        },
        "uses_nondeterministic_randomness": {
          "type": "string",
          "minLength": 1,
          "description": "Why this project exercises uses_nondeterministic_randomness."
        }
      }
    }
  }
}
